{
  "schema_version": 1,
  "id": "modeling-validation-leakage",
  "title": "過学習・検証・データ漏えい",
  "topic": "データ分析",
  "summary": "予測時点と対象に合わせてデータを分け、漏えいを防ぎます。",
  "created_at": "2026-10-31",
  "base_duration_ms": 680,
  "sources": [
    {
      "title": "scikit-learn：Common pitfalls",
      "url": "https://scikit-learn.org/stable/common_pitfalls.html"
    },
    {
      "title": "scikit-learn：Cross-validation",
      "url": "https://scikit-learn.org/stable/modules/cross_validation.html"
    },
    {
      "title": "scikit-learn：Tuning the decision threshold",
      "url": "https://scikit-learn.org/stable/modules/classification_threshold.html"
    }
  ],
  "chunks": [
    {
      "text": "今月の利用状況から、",
      "duration_multiplier": 1.0
    },
    {
      "text": "来月もサービスを使う人を予測するとします。",
      "duration_multiplier": 1.15
    },
    {
      "text": "過去のデータに細かく合わせれば、",
      "duration_multiplier": 1.0
    },
    {
      "text": "そのデータでの正解は増やせます。",
      "duration_multiplier": 1.15
    },
    {
      "text": "しかし、個別の偶然まで覚えて新しい対象で",
      "duration_multiplier": 1.0
    },
    {
      "text": "外れることがあります。",
      "duration_multiplier": 1.15
    },
    {
      "text": "これが過学習です。",
      "duration_multiplier": 1.15
    },
    {
      "text": "新しい対象でも役立つ性質を汎化と呼び、",
      "duration_multiplier": 1.0
    },
    {
      "text": "その確認が必要です。",
      "duration_multiplier": 1.15
    },
    {
      "text": "以下は架空の利用予測です。",
      "duration_multiplier": 1.15
    },
    {
      "text": "学習データは、モデルの係数や規則を決めるために",
      "duration_multiplier": 1.0
    },
    {
      "text": "使います。",
      "duration_multiplier": 1.15
    },
    {
      "text": "検証データは、候補の方法や複雑さ、",
      "duration_multiplier": 1.0
    },
    {
      "text": "判定の境界を選ぶために使います。",
      "duration_multiplier": 1.15
    },
    {
      "text": "最後のテストデータは、",
      "duration_multiplier": 1.0
    },
    {
      "text": "選び終わった方法の成績を評価するために",
      "duration_multiplier": 1.0
    },
    {
      "text": "確保します。",
      "duration_multiplier": 1.15
    },
    {
      "text": "テストの成績を見て何度もモデルを変えれば、",
      "duration_multiplier": 1.0
    },
    {
      "text": "その情報も選択に使ったことになります。",
      "duration_multiplier": 1.15
    },
    {
      "text": "そこでの成績を、",
      "duration_multiplier": 1.0
    },
    {
      "text": "選択から独立した評価としては扱えません。",
      "duration_multiplier": 1.15
    },
    {
      "text": "データが限られる場合は、",
      "duration_multiplier": 1.0
    },
    {
      "text": "一部を順に検証側へ回す交差検証などを使いますが、",
      "duration_multiplier": 1.0
    },
    {
      "text": "最終評価と選択の役割は保ちます。",
      "duration_multiplier": 1.15
    },
    {
      "text": "データ漏えいは、予測する時点で使えない情報や、",
      "duration_multiplier": 1.0
    },
    {
      "text": "評価側の情報がモデル作成に入り、",
      "duration_multiplier": 1.0
    },
    {
      "text": "成績が実力よりよく見えることです。",
      "duration_multiplier": 1.15
    },
    {
      "text": "今月末に予測するのに、来月の利用記録や、",
      "duration_multiplier": 1.0
    },
    {
      "text": "利用終了後に確定する理由を入力すれば、",
      "duration_multiplier": 1.0
    },
    {
      "text": "実際の運用では使えません。",
      "duration_multiplier": 1.15
    },
    {
      "text": "また、欠損を埋める平均や、",
      "duration_multiplier": 1.0
    },
    {
      "text": "尺度をそろえる基準を全データから求めると、",
      "duration_multiplier": 1.0
    },
    {
      "text": "テスト側の情報も混ざります。",
      "duration_multiplier": 1.15
    },
    {
      "text": "分割してから学習側だけで基準を求め、",
      "duration_multiplier": 1.0
    },
    {
      "text": "検証・テスト側にはその基準を適用します。",
      "duration_multiplier": 1.15
    },
    {
      "text": "交差検証でも、各回の学習側で前処理を",
      "duration_multiplier": 1.0
    },
    {
      "text": "学び直す必要があります。",
      "duration_multiplier": 1.15
    },
    {
      "text": "同じ人の月別記録を行ごとに無作為分割すると、",
      "duration_multiplier": 1.0
    },
    {
      "text": "その人の別の月が学習側と評価側に入ります。",
      "duration_multiplier": 1.15
    },
    {
      "text": "未知の利用者への予測を知りたいなら、",
      "duration_multiplier": 1.0
    },
    {
      "text": "利用者単位で分ける必要があります。",
      "duration_multiplier": 1.15
    },
    {
      "text": "一方、既存利用者の将来を予測したいなら、",
      "duration_multiplier": 1.0
    },
    {
      "text": "時間を前後に分け、",
      "duration_multiplier": 1.0
    },
    {
      "text": "予測時点までの履歴だけを使う設計が基本に",
      "duration_multiplier": 1.0
    },
    {
      "text": "なります。",
      "duration_multiplier": 1.15
    },
    {
      "text": "どの分割も万能ではありません。",
      "duration_multiplier": 1.15
    },
    {
      "text": "別拠点への展開を知りたいなら拠点の違い、",
      "duration_multiplier": 1.0
    },
    {
      "text": "将来の利用を知りたいなら時間の変化を",
      "duration_multiplier": 1.0
    },
    {
      "text": "評価へ反映します。",
      "duration_multiplier": 1.15
    },
    {
      "text": "評価期間の結果が確定していない人を、",
      "duration_multiplier": 1.0
    },
    {
      "text": "利用しなかった人として数えないことも必要です。",
      "duration_multiplier": 1.15
    },
    {
      "text": "全体の成績に加え、",
      "duration_multiplier": 1.0
    },
    {
      "text": "目的に必要で適切に扱える範囲で、",
      "duration_multiplier": 1.0
    },
    {
      "text": "地域や利用環境別の誤りを確認します。",
      "duration_multiplier": 1.15
    },
    {
      "text": "件数の少ない層の数値は不安定なため、",
      "duration_multiplier": 1.0
    },
    {
      "text": "分母も示します。",
      "duration_multiplier": 1.15
    },
    {
      "text": "成績が同じであることだけを、",
      "duration_multiplier": 1.0
    },
    {
      "text": "公平な扱いの十分条件にしません。",
      "duration_multiplier": 1.15
    },
    {
      "text": "報告では、予測時点、入力の入手可能時点、",
      "duration_multiplier": 1.0
    },
    {
      "text": "分割単位、調整に使ったデータを記録します。",
      "duration_multiplier": 1.15
    },
    {
      "text": "予測性能を評価する仕組みが整っても、",
      "duration_multiplier": 1.0
    },
    {
      "text": "そのモデルで介入した場合の因果効果まで",
      "duration_multiplier": 1.0
    },
    {
      "text": "確認できたわけではありません。",
      "duration_multiplier": 1.15
    }
  ]
}
