{
  "schema_version": 1,
  "id": "architecture-sync-async-events-queues",
  "title": "同期・非同期・イベント・Queue",
  "topic": "ソフトウェア設計",
  "summary": "処理を待つ同期方式と、Queueやイベントを使う非同期方式の違いを学びます。",
  "created_at": "2026-09-27",
  "base_duration_ms": 680,
  "sources": [],
  "chunks": [
    {
      "text": "申請受付と同時に通知を送る設計では、",
      "duration_multiplier": 1
    },
    {
      "text": "通知先が遅いと画面の応答も遅くなります。",
      "duration_multiplier": 1.15
    },
    {
      "text": "受付を先に確定し、",
      "duration_multiplier": 1
    },
    {
      "text": "通知をキューへ渡すと画面は早く返せます。",
      "duration_multiplier": 1.15
    },
    {
      "text": "同期処理では、",
      "duration_multiplier": 1
    },
    {
      "text": "相手の処理結果を",
      "duration_multiplier": 1
    },
    {
      "text": "待ちます",
      "duration_multiplier": 1.35
    },
    {
      "text": "処理の流れを",
      "duration_multiplier": 1
    },
    {
      "text": "理解しやすいことが",
      "duration_multiplier": 1
    },
    {
      "text": "利点です",
      "duration_multiplier": 1.15
    },
    {
      "text": "ただし、",
      "duration_multiplier": 1
    },
    {
      "text": "相手が遅いと",
      "duration_multiplier": 1
    },
    {
      "text": "全体も待つことになります",
      "duration_multiplier": 1.15
    },
    {
      "text": "非同期処理では、",
      "duration_multiplier": 1
    },
    {
      "text": "依頼後に",
      "duration_multiplier": 1
    },
    {
      "text": "別の処理へ進めます",
      "duration_multiplier": 1.15
    },
    {
      "text": "時間のかかる処理を",
      "duration_multiplier": 1
    },
    {
      "text": "切り離せます",
      "duration_multiplier": 1.15
    },
    {
      "text": "Queueは、",
      "duration_multiplier": 1
    },
    {
      "text": "処理要求を一時的に",
      "duration_multiplier": 1
    },
    {
      "text": "保存して受け渡します",
      "duration_multiplier": 1.15
    },
    {
      "text": "送信側と受信側を、",
      "duration_multiplier": 1
    },
    {
      "text": "時間的に分離できます",
      "duration_multiplier": 1.15
    },
    {
      "text": "イベントは、",
      "duration_multiplier": 1
    },
    {
      "text": "何かが起きたことを",
      "duration_multiplier": 1
    },
    {
      "text": "表します",
      "duration_multiplier": 1.15
    },
    {
      "text": "イベントを受けて",
      "duration_multiplier": 1
    },
    {
      "text": "別の処理を動かす",
      "duration_multiplier": 1
    },
    {
      "text": "設計があります",
      "duration_multiplier": 1.15
    },
    {
      "text": "非同期では、",
      "duration_multiplier": 1
    },
    {
      "text": "処理完了のタイミングが",
      "duration_multiplier": 1
    },
    {
      "text": "分かりにくくなります",
      "duration_multiplier": 1.15
    },
    {
      "text": "通知を後回しにすると受付画面は早く返せますが、",
      "duration_multiplier": 1
    },
    {
      "text": "通知の完了は別の時点になります。",
      "duration_multiplier": 1.15
    },
    {
      "text": "重複処理や",
      "duration_multiplier": 1
    },
    {
      "text": "順序入れ替わりも",
      "duration_multiplier": 1
    },
    {
      "text": "考える必要があります",
      "duration_multiplier": 1.15
    },
    {
      "text": "失敗したメッセージの",
      "duration_multiplier": 1
    },
    {
      "text": "扱いも設計します",
      "duration_multiplier": 1.15
    },
    {
      "text": "監視と追跡可能性が",
      "duration_multiplier": 1
    },
    {
      "text": "重要になります",
      "duration_multiplier": 1.15
    },
    {
      "text": "非同期化は、",
      "duration_multiplier": 1
    },
    {
      "text": "性能だけでなく",
      "duration_multiplier": 1
    },
    {
      "text": "依存を緩めるためにも",
      "duration_multiplier": 1
    },
    {
      "text": "使われます",
      "duration_multiplier": 1.35
    },
    {
      "text": "ただし通知は後で失敗し、",
      "duration_multiplier": 1
    },
    {
      "text": "重複して届く可能性があります。",
      "duration_multiplier": 1.15
    },
    {
      "text": "受付番号で同じ通知を識別し、",
      "duration_multiplier": 1
    },
    {
      "text": "再試行と失敗時の調査方法を決めます。",
      "duration_multiplier": 1.15
    },
    {
      "text": "受付成功と通知成功を別の状態として扱います。",
      "duration_multiplier": 1.35
    },
    {
      "text": "受付と通知の状態を分け、",
      "duration_multiplier": 1
    },
    {
      "text": "再試行で同じ通知が増えないよう識別します。",
      "duration_multiplier": 1.35
    }
  ]
}
